author,role,timestamp,comment,likes
MaxieWoxy,Roadie,2020-09-19 11:26 PM,There's no poor reading comprehension. Your response was so meandering andlacking in logic that whatever point you were trying to make was completelyineffective.It's just silly to me that someone is trying get a solution developed thatalready exists. I want Spotify developers to focus their time on newfunctionality and new technology. Keep raising the bar. Keep innovating.Don't be spending time adding a button that does the same thing we canalready do.,0
Smythee,Newbie,2020-09-20 07:57 AM,"Aw, come on. Be honest. You just like to argue on the Internet. Anyway,let's get into details of how this feature could work vs. your ""solution.""I apologize in advance for meandering, but details are important with UIs.Say a new Jojo Siwa LP appears in my ""New releases for you"" and I'm pumpedto listen to it, but can't at that moment. I click on the LP, then I clickon ""add to playlist"" so I can put it on my ""listen later."" playlist But Ihaven't touched my ""listen later"" for a while. So I have to scroll throughmy playlists, find ""listen later"" and add it.Later in the day, I see there's a new Mercury Rev. I want to hear that, tooso I take the same steps. Three new Guided by Voices come out in a month. Ilather, rinse, repeat.If I do this for a week or two my ""listen later"" playlist becomes ameandering mess of Jojo Siwa, Guided by Voices, Alex Cameron demos, etc.etc.Now, imagine Listen Later functionality like this: Click on the Jojo Siwaalbum, click on the three buttons and there's a ""Add to listen later"" below""Go to radio."" I don't have to scroll to find the ""listen later"" playlist.It's just added.Further, when I go to my library on my phone, there's a ""Listen Later"" tothe right of ""Albums."". When I click that I don't have a garbled playlistof Jojo Siwa and GbV, I have a list of albums, singles, etc. If I want tolisten to Mercury Rev, I click on that. No need to to scroll past the JojoSiwa.tl;dr Your ""solution"" is a clunky workaround. My idea is something manyother users want.",5
mucde,Newbie,2020-10-12 02:07 PM,"I've tried using a playlist but it doesn't work, as you can only add individual songs or all the songs from an album.I like the idea of being able to save things at a higher level.  I know you can follow an artist, but very quickly you end up with too many.  Being able to do a similar thing with a new artist you've discovered, or for an album would be ideal.Having a new playlist type which was at that higher level (artist or album) would allow people the flexibility to do whatever they wanted.",1
MaxieWoxy,Roadie,2020-10-12 02:18 PM,"Not sure I understand this, If you want to follow an artist, add an album(or song) to your ""listen later"" playlist. Now you have a record of theartist and can check their other music out anytime you want.",0
mucde,Newbie,2020-10-12 03:55 PM,"It's about the number of items.  If you add albums for 10 artists, you'll have 100+ tracks in your ""listen later"" playlist.    Which is much tougher to search through, and maintain (on Windows you have to right click on each track to remove from a playlist, easier on a phone).If you browse an artist on a phone you see the individual albums, and it's really quick to find the one you want to listen to.  If you do the same for the same artist on Windows, the album view is expanded to include all the tracks, and it takes much longer to find anything.Perhaps having different variations for following an artist (customisable or things like favourite, like, check out) or for saving an album to your library (favourite, like, check out) is another option.",1
AdamDamon,Spotify Star,2020-11-09 11:32 PM,"I think this is a great idea! Usually when I find music that I'd like to listen to later, I add the albums of interest to temporary playlists, which I can return to in the future; however, over time this can cause my library to become cluttered. A feature for saving albums for later would be a great alternative to this process!",2
parhamhaghighi,Newbie,2020-12-02 06:03 PM,Still waiting for Spotify to add this. Isn't it like YouTube that has a Watch Later? we need this feature!,1
Ponyskip,Visitor,2020-12-21 09:17 AM,"I really need this feature please, I have such a terrible memory and always forget when I come across a new song or album that I want to listen to but can't at that particular time. It would be awesome to be able to just save it to a ""listen later"" list, kinda like YouTube's ""watch later"" list. Please, please, please could you add this function🙏",1
MaxieWoxy,Roadie,2020-12-21 02:16 PM,"Again, ridiculously simple solution already in place. Just create a ""ListenLater"" playlist and add songs to it.##- Please type your reply above this line -Sent from mobile - please excuse typo",0
Bennif,Newbie,2021-01-25 11:09 AM,"I miss also the function like a postponed list, which means, I hear a song from a band never heard before. So I like to know more about the bands music, and want to listen to one ore more albums. BUT NOT NOW. So I put the band in the postponed List an listen to them later. This would increase my listening expierience very much. Kind regards, Bennif",0
feistyla,Music Fan,2021-03-12 09:47 PM,"Agreed!  I was pointed to vote for this one, after I wrote  a similar suggestion ... mine was just more  detailed in explaining  the need to make sure they don't just say ""that's what your save to library is for""... since the reason for this is to differentiate a to-listen bucket, separate from the  favorites bucket.And... because contrary to what other commenters here think... you can't add Albums or playlists to a 'listen later' playlist... and some device interfaces don't even have the ability to view or manage your library by any custom groupings. [I use Spotify mostly via Roku or Kindle, so that's why a button besides the 'heart' would be important!  Even on my Macbook laptop it's still a lousy interface to try and organize saved-playlists or albums.... not designed for serious collections.)https://community.spotify.com/t5/Closed-Ideas/Your-Library-Separate-flags-needed-to-quot-Check-it-ou...",1
nyagrd,Casual Listener,2021-03-13 01:17 PM,"i don't know if anyone already said this but just in case no one didn't: it'd also be really great to be able to save artists & bands & playlists as ""listen later"". sure this can somewhat be done by following them, but i like to only follow artists i already know i like, and i'm probably not the only one. and a lot of my liked playlists are also really just ""listen later"" playlists so it'd be great to have an actual feature to make all of this cleaner. spotify could also turn this into a little display on the front page to remind us of all the artists and albums and playlists we have saved for later!",1
MaxieWoxy,Roadie,2021-03-14 09:03 PM,"Years later and it still cracks me up that people continue to ask for something you can already do pretty easily. That's probably why Spotify has never taken the time to add something redundant.  You can add albums to a playlist. If the functionality is not in the Roku or Kindle app, sorry about your luck but pretty sure they are never going to invest much in those ""lite"" app versions.  I typically annually average listening to more than 100 songs per day. I add songs and albums to my ""To Do"" playlist all the time and it's very, very easy to manage. Sometimes I add one song to remind me to go back and check out an artist fully when I have time. I also have a ""give another spin"" playlist for things I checked out and want to maybe dive deeper or listen further before I decide to save them to favorites or other playlists.  Again, very easy to manage music with playlists. Also very easy to move entire playlists into another playlist if I want to.",0
Bennif,Newbie,2021-03-17 09:52 AM,"Hello MaxieWoxy,  that´s not the same. If you add an album to a playlist, you see lots of songs in the Playlist, but not the album itsself.At what if I want to add an Artist to my Playlist?? It doesn´t work. So where is the problem to mark an Artist, an Album or just a song with a flag listen later???  So if you can provide a soliution, where I can put an Artist in a playlist with his whole work, let me know. Otherwise you suggestions is not helping people like me, who want Spotify to add a little help for expandig there musical horizon.  It is just a small feature for some users, which will help to satisfy there needs.  Regards Bennif",0
MaxieWoxy,Roadie,2021-03-17 02:06 PM,"There is a simple solution. Add one song by that artist to your playlist.That is your reminder to check out that artist. All you have to do fromthere is click the artist name to go to their catalog.And yes, you can add entire albums to playlists.It is really not complicated...at all. I am not sure why everyone is makingit out to be.",0
Bennif,Newbie,2021-03-17 03:06 PM,"Once again, this is NOT the same. And I know that it is possible to add entire albums, but all the songs will be displayed. I want just to have the name of the album in the list, and under the album the titles. Just like in e.g. a windows folder. To clearify what I, and I think all the others mean: Play Later ListArtist 1Album 1 - all the songsAlbum 2 - all the songsArtist 2Just one SongArtist 3 - the entire work But I guess you are satisified with your solution, and you will try to bring your idea to be the solution for me. And NO it is not what I am searching for.",2
Bennif,Newbie,2021-03-17 03:13 PM,"If you want to paint your house yellow, paint it yellow, but please don´t try to make me to paint my house yellow because yellow is the only color you think a house should be painted. I like to paint my house e.g. in blue.",1
MaxieWoxy,Roadie,2021-03-17 03:34 PM,"Wow. So you want something highly customized because you feel entitled tohave it just the way you want it? Everything you are describing can beachieved by playlists as of today.You want an album saved for listening to later? Add that album to aplaylist called Listen Later.You want to remember an artist for listening to later? Add a song by thatartist to a playlist called Listen Later.You want a song saved for listening to later? Add that song to a playlistcalled Listen Later.If you feel the need to separate them, create playlists called Listen LaterAlbums, Listen Later Artists and Listen Later Songs.It's not that hard. It works very easily today. Unless you requireeverything absolutely spoon fed to you. I don't think Spotify developersshould be focusing on that kind of thing, however.",0
mucde,Newbie,2021-03-17 03:40 PM,"@MoxieWoxy - Thanks for sharing your suggestion the first time, it clearly works for you and could be a useful method for other people, that's the great part about having an idea exchange.But repeating the same thing 10+ times in this thread feels like trolling or attention-seeking.  Your last post comes across negatively.  The reality is that the developers are only ever likely to consider things with the most votes, and then only if technically it's possible and won't have a negative impact on database load.",2
MaxieWoxy,Roadie,2021-03-17 03:53 PM,"I am sorry if you took the response negatively. Admittedly, it isfrustrating that people keep asking for something that is easily donetoday. Perhaps that is why Spotify has never acted on it.If it can work for me, someone who uses Spotify all day almost every day,it can certainly work for casual listeners. It's not a complex solution.I think your house painting analogy was a little off. No one is telling youwhat color your house should be. It's more like suggesting that you don'tneed to hire a contractor to paint for you when you already have theability to do it yourself without the wait and cost.🙂",0
Bennif,Newbie,2021-03-17 04:08 PM,"MaxieWoxy,  thank you very much for your suggestion, but it will not help no matter how many times you repeat it.  And I also found the post little aggressive and negative.  By the way, you are again trying to convince me of YOUR idea.  @mucde: thank you for your support",0
mucde,Newbie,2021-03-17 04:19 PM,"@MoxieWoxyI think you said it well in your opening paragraph, you're finding it frustrating seeing people discussing this topic, perhaps unsubscribe from update notifications, and spare yourself from future frustration?I use Spotify a similar amount of time to you and am always on the hunt for new music, but personally find the playlist option soon becomes very cluttered (this is my house colour to use Bennif's analogy).  In my reach for the skies solution, I would prefer to be able to categorise artists and albums in different ways, so I could filter for favourites, new discoveries, etc.I don't expect these changes to happen soon, or maybe at all, but that shouldn't stop me or others to be able to imagine a different house colour.  Maybe that makes me a dreamer and you a realist, but I still want the opportunity to live in that real world and still have the freedom to dream.",2
MaxieWoxy,Roadie,2021-03-17 04:21 PM,I'm sorry you found it aggressive. Perhaps you're being just a little oversensitive? It's an internet forum to exchange ideas and tips and that's allthat is occurring.Just stating facts and a solution. I guess I'm having a hard timeunderstanding how a solution as it exists today is too cumbersome and/ordifficult.,0
Bennif,Newbie,2021-03-17 04:37 PM,"Mucde: Perfectly described, that's exactly how I think too, but Maxie Woxy doesn't seem to want to understand this.   Even worse, we are too sensitive to his charming way of persuasion. The post was already Ok MaxieWoxy, but why can't you let us have our wishes? But that's the way society is today. In an Anonymous Forum you can bash without hesitation. And this is meant in general and not related to MaxieWoxy.",0
MaxieWoxy,Roadie,2021-03-17 07:22 PM,"I'm not bashing anyone. Again, I think you are being overly sensitive. I shouldn't be frustrated by the fact that there is what I perceive as a very easy solution to the perceived problem when people keep asking for something in spite of that. If someone could explain to me what is so hard about using existing playlists to help you save stuff for listening to later, that would probably help. But that has never happened. As a logical person, creating a playlist called ""Listen to Later Artists"" and adding a song by the artist is all I need to keep track of artists I want to listen to later. Open up the playlist, click on the artist name and BOOM, you're there. To mucde's point, unsubscribing is my answer so I can be blissfully unaware of more of these requests.🙂So thanks cheers to you for that suggestion!",0
feistyla,Music Fan,2021-03-17 08:31 PM,"To clarify forMaxieWoxyand anyone else who is confused.... this need of 'Save for later"" or ""Check it out later""  is so you can save Playlists or Albums to check out later... which you CAN""T add to a playlist, because that just lumps the songs up... totally different than this need.The same way there's a ""Heart"" icon to quickly save something to your favorites library.... There needs to be an equal but different icon,  so you don't muddy up your favorites with stuff you haven't decided on yet!  AND.... the need is to do it from any device quick and easy. So... an icon like a check or ""list"", parallel to the 'heart'.(Not all interfaces let you access folders or playlists to choose when 'liking' something, so it's all just a big bucket despite the talked-about folder-feature for playlist-organizing .... I tried that approach but it's a cumbersome interface even on the laptop, and not available at all via KindleFire or Roku-app use .   I've made a separate plea regarding that problem)",3
MaxieWoxy,Roadie,2021-03-17 09:15 PM,"Regarding the playlist issue, isn't that the purpose of the ""Follow"" function?  Not sure I understand the issue adding an album. I can add an entire album to any playlist I desire. And with sorting the playlist by album (or even add time) it doesn't jumble them all up.",0
Bennif,Newbie,2021-03-18 09:32 AM,"It is fascinating, most of the people seem to understand, why this wish exists, except MaxieWoxy. I don´t know why. Like a Prayer mill....@MaxieWoxy: By the way,  I´m sure you didn´t read my last sentence in my last post, otherwise you wouldn´t start with ""I'm not bashing anyone...."" Always the same information, without any help or information, I did not already know before. The usage hint matches not others and my needs, what is so hard to accept?  Thanks to all the others, who understand the need and accept the idea.  @MaxieWoxy - I use it the way you suggested since I use spotify, which means for years. And still I have the need for a  PLAY LATER LIST!!!  Just to get some structure in the List.",1
AdSR,Roadie,2021-04-01 03:18 PM,"There is a difference between a workaround and an actual solution. Adding a song from an album to a playlist is a workaround. A ""listen later"" button as in the submission is a solution. There is a real difference in usability.  There is also the thing with all kinds of suggested listening lists on the main screen: I can go into an album and save one song into a ""listen later"" playlist, but when I go back the suggestion list may get refreshed and a couple other albums I also wanted to save for later may not be there anymore. If I could tag them right from the screen I would not lose them.",1
Teradactol,Newbie,2021-04-23 10:04 PM,"I discovered the Spicetify Bookmark extension recently and this can be used to save albums to a ""Listen Later"" page.  Demo:https://streamable.com/0qh6p Installation instructions:https://github.com/khanhas/spicetify-cli  Spicetify also contains numerous other extensions like Lyrics, New Release notifications, a Reddit app,... Of course not everyone feels comfortable playing with the spotify code like this, but it works very well and might be worth checking out.  Only downside is that it doesn't work with the new UI upgrade yet, so I'm debating whether I want to drop the Bookmark extension to try the new UI. I have really gotten used to the extension and it is so much more user friendly than saving everything in a playlist. It would be great if Spotify could implement something similar.",1
6ucci6an6,Casual Listener,2021-05-06 04:26 AM,"you can Listen to Later   for Songs, Albums, and Artists you are interested in but want to check out later   similar to YouTubes “Watch Later” list,    So many artists and albums I forget about because I put them off for later.",4
Skiadrum,Regular,2021-05-11 02:24 AM,"ooo this would be great, i kinda already do that bc I have a ""try later"" playlist but this would make it so much easier. and maybe there could be a setting that automatically deletes the song from the ""listen later"" thing once you've listened to it, bc i have to keep going and deleted songs from my ""try later"" playlist after I've listened to them",0
Anonymous-2020,Casual Listener,2021-06-22 01:38 PM,Understand this feature is not yet available on the mobile app (which I primarily use): A ‘save for later’ playlist which I can add new discoveries to and revisit whenever I have to time to listen to them-This playlist should also grey out a song once I listen to it;,2
Brycelambert999,Visitor,2021-07-13 01:58 AM,"I get many recommendations for songs and albums to check out throughout the day but often find myselfforgetting about them. Rather than adding these albums/songs to a playlist, it would be great to implement a “Listen Later” tab where I can go back and revisit them easily. It could be similar to the wishlist tab on Amazon, for example, with Spotify giving you periodic notifications to check out your listen later tab. Let me know what you think!",9
hickups,Visitor,2021-07-28 08:27 PM,"I had the same idea for a while and thought I might add that it would be amazing to not only be able to add songs, but also albums, artists and other playlists to check out at a later time!",2
Nehircakmak,Visitor,2021-08-06 12:47 PM,"If there's ""Listen Later"" section that would be amazing. Cauze your seeing a song and you don't have time to listen it but you don't want to lose it. We usually write this to notes but if Spotify  has a section like this that would be SUPEEER COOOL",2
meeggaanx,Casual Listener,2021-08-18 02:24 PM,"Can this feature please happen! I always find certain albums, songs and podcasts that I want to listen to but not at the current moment and never know where to save them. I end up adding them to random playlists and in the end I forget about it and never get around to listening to them simply because I've added and saved them in random areas. A 'Listen Later' section, that is divided up into Playlists, Songs, Albums, Artist and Podcasts categories would really make navigating through future listening items so much easier and neater! Please consider this feature!",3
Ddoctor94,Visitor,2021-08-27 04:06 AM,Would love to see this,2
pervigilo,Casual Listener,2021-08-27 06:51 AM,"i'd love this so much. i save albums a lot to listen later, but i hate how it clutters my holy grail albums with ones im just curious about. it'd be awesome if my saved albums could be my ""library"" and then there was a separate section for ones i just want to work thru and give a chance. right now im grinding thru my albums so i can have a semblance of order by having my holy grails always sorted as the oldest to keep it separate, but it's messy and a lot of upkeep especially when new ones become favorites.  in general finding a way to simulate a ""real life"" collection more would be really cool.",2
MaxieWoxy,Roadie,2021-08-27 03:00 PM,Why wouldn’t your “holy grail” albums just be in a separate playlist fromthe albums you want to just check out?,0
pervigilo,Casual Listener,2021-08-30 08:02 PM,"for me, it's like going into a library and having to pick up my books chapter by chapter. I'd just rather have the books bound and complete when I go to read them - in the same way, i'd like my favorite albums ""bound"" in their organizational structure rather than arranged in units of songs. it works better with my brain to see it this way.  in effect, the whole book/album is there even if it has to be arranged in pieces, but it doesn't feel the same.  it's ok if you feel differently, and i'm glad the current system works for you; at the end of the day this being added wouldn't in any way affect your ability to use your listen later playlist.🙂",2
Pablo051288,Visitor,2021-08-31 05:06 AM,"Hi! How are you?I would like if Spotify add a more section within ""Your Library"" as for example ""Albums to listen"" that helps as a reminder of new disks to discover, and so you can differentiate it from the ""albums"" folder to have the collection of discs that welike. Ty!",2
Bennif,Newbie,2021-08-31 09:05 AM,"Thank you Pervigilo, perfectly described!  As an idea, the Songs which should be thrown in the play later list, could be marked by a third Icontype e.g. a hourglass  @MaxieWoxy: Why are you still trying to convince people of your idea, when you must see that many want something else?",1
adrelaxn,Casual Listener,2021-09-25 11:30 AM,pls spotify do it,2
22qoor412srfq,Casual Listener,2021-10-13 09:09 AM,Oh my god yes! I just think about this!,4
jachildr,Newbie,2021-10-13 03:45 PM,"I need this! I agree that playlists are a slight workaround, but not very effective for separate albums.",3
slliner,Newbie,2021-10-15 12:09 PM,"My idea is a simple quality-of-life one and I absolutely feel like it would improve navigation through Spotify. I often find myself wanting to listen to a bunch of new albums or single. The thing is that I also forget about them later on if a certain album is long and it takes a while to finish. This results in me never listening to those new songs ever again or till I eventually stumble across them. I'm suggesting for some sort of ""Add to listen later"" feature on an album/song. This feature would be extremely convenient, especially when you're on the go. It would act as a playlist, but when one finishes listening to a song, the song gets removed from the list.",5
Chemgaming10,Visitor,2021-10-15 09:42 PM,There should be a feature that adds songs/albums to an automatic playlist to listen to later when you don't have the time. It would make it so when you do listen to the song it would remove it from the playlist. Alternatively there can be an option to disable this feature.,9
Alex,Spotify Legend,2021-10-17 12:14 PM,"Updated on2021-10-17 Hello@slliner,  Thanks for submitting your idea to the Idea Exchange!  We've gone ahead and marked this as a new suggestion. Spotify Staff will look into this idea once it reaches the necessary amount of votes.  More info on how your feedback reaches Spotify via the Idea Exchange can be foundhere.  Cheers!",1
Alex,Spotify Legend,2021-10-17 02:41 PM,"Updated on2021-10-17 Hello@Chemgaming10,  Thanks for submitting your idea to the Idea Exchange!  We've gone ahead and marked this as a new suggestion. Spotify Staff will look into this idea once it reaches the necessary amount of votes.  More info on how your feedback reaches Spotify via the Idea Exchange can be foundhere.  Cheers!",1
Unknown,Not applicable,2021-10-20 08:45 PM,"In its intentions the idea is not bad but it should be implemented better: in my opinion if you like something from the ""listen later"" playlist you have to clearly state it through a voluntary action, the algorithm does not read your thought, so if something "" listen later ""you like it requires you to consciously add it to your music library. Then I agree. I wouldn't want to find albums, playlists, songs in my music library just for wanting to try them once or twice.",1
